{
  "artifacts": {
    "estimate": {
      "arithmetic_intensity_operations_per_byte": 5.0,
      "bandwidth_ceiling_operations_per_second": 5000000000000.0,
      "compute_ceiling_operations_per_second": 2000000000000.0,
      "limiting_resource": "compute",
      "upper_bound_operations_per_second": 2000000000000.0
    }
  },
  "conclusion": "The lower roof is compute in this synthetic configuration.",
  "configuration": {
    "bandwidth_bytes_per_second": 1000000000000.0,
    "bytes_moved": 200000000.0,
    "operations": 1000000000.0,
    "peak_operations_per_second": 2000000000000.0
  },
  "derived_metrics": [
    {
      "evidence": "estimated",
      "name": "roofline_upper_bound",
      "unit": "operations per second",
      "value": 2000000000000.0
    }
  ],
  "environment": {
    "execution": "CPU-only formula",
    "hardware": "synthetic qualified profile"
  },
  "hypothesis": "The declared operation has sufficient arithmetic intensity to meet the compute ceiling.",
  "limitations": [
    "Ceilings are supplied assumptions, not a device measurement.",
    "The calculation omits launch, synchronization, and cache effects."
  ],
  "raw_measurements": [
    {
      "evidence": "estimated",
      "name": "arithmetic_intensity",
      "unit": "operations per byte",
      "value": 5.0
    },
    {
      "evidence": "estimated",
      "name": "bandwidth_ceiling",
      "unit": "operations per second",
      "value": 5000000000000.0
    }
  ],
  "record_id": "roofline-prefill-estimate-v1",
  "result_type": "estimated",
  "schema_version": "1.0",
  "sources": [],
  "title": "Prefill-shaped roofline estimate with synthetic device ceilings",
  "workload": {
    "operation_shape": "many input tokens",
    "phase": "prefill"
  }
}
