{
  "artifacts": {
    "aggregates": {
      "chunked": {
        "completed_output_tokens": 63,
        "completed_requests": 8,
        "goodput_request_fraction": 1.0,
        "goodput_requests_per_tick": 0.36363636363636365,
        "makespan_ticks": 22,
        "output_tokens_per_tick": 2.8636363636363638,
        "p50_completion_ticks": 9,
        "p50_ttft_ticks": 6,
        "p95_completion_ticks": 17,
        "p95_ttft_ticks": 12,
        "request_throughput_per_tick": 0.36363636363636365
      },
      "continuous": {
        "completed_output_tokens": 63,
        "completed_requests": 8,
        "goodput_request_fraction": 1.0,
        "goodput_requests_per_tick": 0.38095238095238093,
        "makespan_ticks": 21,
        "output_tokens_per_tick": 3.0,
        "p50_completion_ticks": 10,
        "p50_ttft_ticks": 6,
        "p95_completion_ticks": 18,
        "p95_ttft_ticks": 13,
        "request_throughput_per_tick": 0.38095238095238093
      },
      "static": {
        "completed_output_tokens": 63,
        "completed_requests": 8,
        "goodput_request_fraction": 1.0,
        "goodput_requests_per_tick": 0.3333333333333333,
        "makespan_ticks": 24,
        "output_tokens_per_tick": 2.625,
        "p50_completion_ticks": 12,
        "p50_ttft_ticks": 9,
        "p95_completion_ticks": 20,
        "p95_ttft_ticks": 16,
        "request_throughput_per_tick": 0.3333333333333333
      }
    }
  },
  "conclusion": "Chunked scheduling has the lowest p95 TTFT in this trace, while continuous scheduling has the highest output throughput.",
  "configuration": {
    "strategies": [
      "static",
      "continuous",
      "chunked"
    ]
  },
  "derived_metrics": [
    {
      "evidence": "simulated",
      "name": "static_output_throughput",
      "unit": "tokens per tick",
      "value": 2.625
    },
    {
      "evidence": "simulated",
      "name": "continuous_output_throughput",
      "unit": "tokens per tick",
      "value": 3.0
    },
    {
      "evidence": "simulated",
      "name": "chunked_output_throughput",
      "unit": "tokens per tick",
      "value": 2.8636363636363638
    }
  ],
  "environment": {
    "execution": "deterministic CPU-only discrete-event simulation",
    "hardware": "not applicable",
    "seed": 0
  },
  "hypothesis": "A policy can improve tail TTFT while reducing aggregate output throughput under the declared abstract work model.",
  "limitations": [
    "The scheduler capacity is an abstract work-unit model.",
    "The trace is synthetic and intentionally small for inspection."
  ],
  "raw_measurements": [
    {
      "evidence": "simulated",
      "name": "static_p95_ttft",
      "unit": "ticks",
      "value": 16.0
    },
    {
      "evidence": "simulated",
      "name": "continuous_p95_ttft",
      "unit": "ticks",
      "value": 13.0
    },
    {
      "evidence": "simulated",
      "name": "chunked_p95_ttft",
      "unit": "ticks",
      "value": 12.0
    }
  ],
  "record_id": "batching-comparison-v1",
  "result_type": "simulated",
  "schema_version": "1.0",
  "sources": [],
  "title": "Static, continuous, and chunked scheduling on the fixed mixed-length trace",
  "workload": {
    "requests": [
      {
        "arrival_tick": 0,
        "input_tokens": 8,
        "model": "example-transformer",
        "output_tokens": 8,
        "priority": 0,
        "request_id": "r1",
        "shared_prefix_tokens": 0
      },
      {
        "arrival_tick": 0,
        "input_tokens": 12,
        "model": "example-transformer",
        "output_tokens": 4,
        "priority": 0,
        "request_id": "r2",
        "shared_prefix_tokens": 0
      },
      {
        "arrival_tick": 1,
        "input_tokens": 4,
        "model": "example-transformer",
        "output_tokens": 12,
        "priority": 1,
        "request_id": "r3",
        "shared_prefix_tokens": 0
      },
      {
        "arrival_tick": 2,
        "input_tokens": 16,
        "model": "example-transformer",
        "output_tokens": 4,
        "priority": 0,
        "request_id": "r4",
        "shared_prefix_tokens": 0
      },
      {
        "arrival_tick": 3,
        "input_tokens": 6,
        "model": "example-transformer",
        "output_tokens": 10,
        "priority": 1,
        "request_id": "r5",
        "shared_prefix_tokens": 0
      },
      {
        "arrival_tick": 5,
        "input_tokens": 10,
        "model": "example-transformer",
        "output_tokens": 6,
        "priority": 0,
        "request_id": "r6",
        "shared_prefix_tokens": 0
      },
      {
        "arrival_tick": 6,
        "input_tokens": 3,
        "model": "example-transformer",
        "output_tokens": 14,
        "priority": 1,
        "request_id": "r7",
        "shared_prefix_tokens": 0
      },
      {
        "arrival_tick": 8,
        "input_tokens": 14,
        "model": "example-transformer",
        "output_tokens": 5,
        "priority": 0,
        "request_id": "r8",
        "shared_prefix_tokens": 0
      }
    ],
    "time_unit": "abstract scheduler tick"
  }
}
